{
  "testId": "EVD-I0-001",
  "version": "1.0.0",
  "owner": "Chief Architect / Engineering Owner",
  "requirements": [
    "CHG-036 §3",
    "SPEC-008 §3",
    "IMP-001 §2 I0"
  ],
  "subject": {
    "artifact": "Increment I0 Foundation",
    "commitOrBuild": "b817cbf124d384a77698497815330eb916277918"
  },
  "environment": "GitHub Actions Ubuntu runner; disposable local Docker PostgreSQL validation",
  "dataSet": "No production data; empty migration set and local development placeholders only",
  "executor": "Chief Architect / Engineering Owner",
  "startedAt": "2026-08-08T16:07:04Z",
  "endedAt": "2026-08-08T16:07:28Z",
  "expectedResult": "I0 quality gates pass and the implementation remains limited to tooling, local environment, schema tooling, test harnesses, CI quality gates, and evidence collection.",
  "actualResult": "Passed. Master CI completed successfully for merge commit b817cbf. Repository quality, Gitleaks, dependency audit, format, lint, type, unit, OpenAPI, and evidence-schema checks passed. The local migration harness was exercised with no migrations and no production data. No product capability, provider integration, or production deployment entered scope.",
  "evidence": [
    "GitHub Actions run 31266159854: https://github.com/muzeeb82/Aegis-IOS/actions/runs/31266159854",
    "Merge commit b817cbf124d384a77698497815330eb916277918",
    "PR #3: https://github.com/muzeeb82/Aegis-IOS/pull/3"
  ],
  "disposition": "Passed",
  "defects": [],
  "reviewer": "Chief Architect / Engineering Owner; compensating controls: pull-request and merge CI evidence"
}
