{
  "testId": "EVD-I2-001",
  "version": "1.0.0",
  "owner": "Chief Architect / Engineering Owner",
  "requirements": [
    "CHG-045 §§2, 3, and 5",
    "SPEC-001 §§4, 5, 6, 7, 13, and 19 (AC-001–004, AC-011–012)",
    "SPEC-002 §§2–5 and 7",
    "SPEC-004 §2",
    "SPEC-008 §§2–5",
    "IMP-001 §2 I2"
  ],
  "subject": {
    "artifact": "Increment I2 Decision, Evidence, and Traceability Lifecycle",
    "commitOrBuild": "da3e435a19c45472094b192b7029cfb37142217f"
  },
  "environment": "GitHub Actions Ubuntu runner with PostgreSQL 17-alpine service; disposable local Docker PostgreSQL validation",
  "dataSet": "Synthetic decision, evidence, provenance, transformation, approval, and traceability data only; no production data or live provider",
  "executor": "Chief Architect / Engineering Owner",
  "startedAt": "2026-08-08T19:11:47Z",
  "endedAt": "2026-08-08T19:12:34Z",
  "expectedResult": "The authorized I2 decision, evidence, provenance, immutable revision, lifecycle, authorization, traceability, migration, rollback, and reconciliation controls pass without entering deferred scope.",
  "actualResult": "Passed. GitHub Actions run 31273823227 completed successfully: repository hygiene, Gitleaks, full dependency audit, I1 regression validation, I2 migration apply/status, synthetic persistence, live database rejection of decision and evidence revision overwrites, synthetic transactional-DDL rollback, reconciliation, formatting, linting, strict type checking, 22 unit tests, OpenAPI validation, and evidence-schema validation. Independent review passed after direct verification of every I2 aggregate envelope and every mutation authorization path. No portfolio, framework execution, outcome learning, AI, connector, live provider, production data, production infrastructure, or release capability was introduced.",
  "evidence": [
    "GitHub Actions run 31273823227: https://github.com/muzeeb82/Aegis-IOS/actions/runs/31273823227",
    "PR #8 independent review and follow-up diff review",
    "Commits 57116bf and da3e435"
  ],
  "disposition": "Passed",
  "defects": [],
  "reviewer": "Independent review passed after re-checking the resolved envelope, authorization, and database immutability findings"
}
