{
  "testId": "EVD-I1-001",
  "version": "1.0.0",
  "owner": "Chief Architect / Engineering Owner",
  "requirements": [
    "CHG-044 §§2, 3, and 5",
    "SPEC-002 §§3 and 7",
    "SPEC-004 §§2, 3, 6, and 7",
    "SPEC-008 §3",
    "IMP-001 §2 I1"
  ],
  "subject": {
    "artifact": "Increment I1 Identity, Authorization, Audit, and Record Foundation",
    "commitOrBuild": "606520200e22b07d491ad66bf91a5c573ec1791a"
  },
  "environment": "GitHub Actions Ubuntu runner with PostgreSQL 17-alpine service; disposable local Docker PostgreSQL validation",
  "dataSet": "Synthetic identity, authorization, policy, evidence, and audit data only; no production data or live provider",
  "executor": "Chief Architect / Engineering Owner",
  "startedAt": "2026-08-08T18:05:52Z",
  "endedAt": "2026-08-08T18:06:33Z",
  "expectedResult": "The authorized I1 identity, authorization, audit, migration, threat-model, and evidence controls pass without entering excluded scope.",
  "actualResult": "Passed. CI completed successfully: repository hygiene, Gitleaks, full dependency audit, migration apply/status, synthetic persistence, synthetic transactional-DDL rollback, formatting, linting, strict type checking, 13 unit tests, OpenAPI linting, and evidence-schema validation passed. External review of the final commit passed after remediation of its findings. No live provider, user-facing sign-in, product workflow, production data, production infrastructure, or release capability was introduced.",
  "evidence": [
    "GitHub Actions run 31271079640: https://github.com/muzeeb82/Aegis-IOS/actions/runs/31271079640",
    "PR #5 external review and final diff review",
    "Commits 2c161f2, 0bf00b8, and 6065202"
  ],
  "disposition": "Passed",
  "defects": [],
  "reviewer": "External review passed; CI and final diff review provide recorded validation evidence"
}
